<?xml version="1.0" encoding="UTF-8"?>
<!ELEMENT atomic_namber (#PCDATA)>
<!ELEMENT atomic_mass (#PCDATA)>
<!ELEMENT name (#PCDATA)>
<!ELEMENT electrons_on_layer (#PCDATA)>
<!ELEMENT symbol (#PCDATA)>
<!ELEMENT kind (#PCDATA)>
<!ELEMENT group (#PCDATA)>
<!ELEMENT period (#PCDATA)>
<!ELEMENT position (group, period)>
<!ATTLIST element id CDATA #REQUIRED>
<!ELEMENT element (atomic_namber, atomic_mass, name, electrons_on_layer, symbol, kind, position)>
<!ELEMENT elements (element)+>
<!ELEMENT elements_table (elements)>